variable,Wave1,Wave2,Wave3,Wave4,Wave5,Wave6,primary_domain,all_domains,n_waves
q56,,"Even if parents' demands are unreasonable, children still should do what they ask","q56. When a mother-in-law and a daughter-in-law come into conflict, even if the mother-in-law is in the wrong, the husband should still persuade his wife to obey his mother.","56. In a group, we should sacrifice our individual interest for the sake of the group's collective interest.","56 Among the political parties listed here, which party if any do you feel closest to?","56 For the sake of the family, the individual should put his personal interests second.",other,other,5
q57,,"Being a student, one should not question the authority of their teacher","q57. Being a student, one should not question the authority of their teacher.","57. For the sake of national interest, individual interest could be sacrificed.","57 How close do you feel to (answer in Q56)? Is it very close, somewhat close, or just a little close?","57 In a group, we should sacrifice our individual interest for the sake of the group's collective interest.",other,other,5
q59,,A person should not insist on his own opinion if his co-workers disagree with him,"q59. Even if there is some disagreement with others, one should avoid the conflict","59. When dealing with others, one should not only focus on immediate interest but also plan for future.","59 In a group, we should sacrifice our individual interest for the sake of the groups collective interest.","59 When dealing with others, developing a long-term relationship is more important than securing one's immediate interest.",other,other,5
q60,,"For the sake of the family, the individual should put his personal interests second",q60. A person should not insist on his own opinion if his co-workers disagree with him,"60. Even if parents' demands are unreasonable, children still should do what they ask.","60 For the sake of national interest, individual interest could be sacrificed.","60 Even if parents' demands are unreasonable, children still should do what they ask.",other,other,5
q61,,Sometimes one has to follow one's own beliefs regardless of what other people think,"q61. Wealth and poverty, success and failure are all determined by fate.","61. When a mother-in-law and a daughter-in-law come into conflict, even if the mother-in-law is in the wrong, the husband should still persuade his wife to obey his mother.","61 When dealing with others, developing a long-term relationship is more important than securing one's immediate interest.","61 When a mother-in-law and a daughter-in-law come into conflict, even if the mother-in-law is in the wrong, the husband should still persuade his wife to obey his mother.",other,other,5
q63,,Open quarrels (criticisms) among politicians are harmful to society,"q63. When dealing with others, one should not be preoccupied with temporary gains and losses.","63. In a group, we should avoid open quarrel to preserve the harmony of the group.","63 When a mother-in-law and a daughter-in-law come into conflict, even if the mother-in-law is in the wrong, the husband should still persuade his wife to obey his mother.","63 In a group, we should avoid open quarrel to preserve the harmony of the group.",other,other,5
q64,,The relationship between the government and the people should be like that between parents and children,"q64. In the past three (3) years, have you never, once, or more than once done the following because of personal, family, or neighborhood problems, or problems with government officials and policies?Contacted elected officials or legislative representativ","64. Even if there is some disagreement with others, one should avoid the conflict.","64 Being a student, one should not question the authority of their teacher.","64 Even if there is some disagreement with others, one should avoid the conflict.",other,other,5
q67,,How closely do you follow major events in foreign countries/the world?,q67. Contacted other influential people outside the government,"67. If one could have only one child, it is more preferable to have a boy than a girl.",67 A person should not insist on his own opinion if his co-workers disagree with him.,"67 If one could have only one child, it is more preferable to have a boy than a girl.",other,other,5
q68,,"Have you traveled abroad before? If you have, how often do you travel abroad?",q68. Contacted news media,"68. When dealing with others, one should not be preoccupied with temporary gains and losses.","68 Wealth and poverty, success and failure are all determined by fate.","68 In the past three years, have you ever contacted elected officials or legislative representatives at any level?",other,other,5
q70,,We should give up gains in the present for the possibility of larger gains in the future,q70. Got together with others to raise an issue or sign a petition,70  Contacted officials at higher level-3 categories.,"70 In the past three years, have you ever contacted elected officials or legislative representatives at any level","70  Contacted other influential people outside the government, such as traditional leaders/community leaders",other,other,5
q71,,Conflict among political groups is not a bad thing for our country,q71. Attended a demonstration or protest march,71 Contacted traditional leaders/community leaders-3 categories,71 Contacted civil servants or officials,71  Contacted news media,other,other,5
q73,,The best way to deal with complicated political issues should be to leave them to the future,"q73. Thinking of whether you voted or not ever since you became eligible for voting, how would you describe yourself -have you voted in every election, voted in most elections, voted in some elections or hardly ever voted?",73  Contacted news media-3 categories,73 Contacted news media,73  Used the Internet including Social Media Networks to express opinions about politics,other,other,5
q74,,Political reform should be introduced little-by-little instead of all-at-once,"q74. Let's talk for a moment about the kind of government you would like to have in this country, which of the followings statements do you agree with most? Choose the first or the second statement. [Interviewer: Probe whether respondent strongly agrees o",74 Whether you personally have ever got together with others to try to resolve local problems-3 categories,74 Signed a paper petition,74  Joined a group to activiely support a cause [including online],other,other,5
q77,,The most important thing for political leaders is to accomplish their goals even if they have to ignore the established procedure,"q77. Let's talk for a moment about the kind of government you would like to have in this country, which of the followings statements do you agree with most? Choose the first or the second statement. [Interviewer: Probe whether respondent strongly agrees o",77 Used force or violence for a political cause-3 categories,77 Joined a group to actively support a cause(including online),77  Taken an action or done something for a political cause that put you in risk of getting injured,other,other,5
q86,,Refused to pay taxes or fees to the government,"q86. If you have to choose only one from each four sets of statements that I am going to read, which one would you choose as the most essential characteristics of a democracy?",86. I would rather live under our system of government than any other that I can think of,"86 Over the long run, our system of government is capable of solving the problems our country face",86 Which one would you choose as the most essential characteristics of a democracy: Set 2?,other,other,5
q87,,Got together with others to raise an issue or sign a petition,"q87. If you have to choose only one from each four sets of statements that I am going to read, which one would you choose as the most essential characteristics of a democracy?","87. would you say our system of government works fine as it is, needs minor change, needs major change, or should be replaced?","87 Thinking in general, I am proud of our system of government",87 Which one would you choose as the most essential characteristics of a democracy: Set 3?,other,other,5
q88,,Attended a demonstration or protest march,"q88. If you have to choose only one from each four sets of statements that I am going to read, which one would you choose as the most essential characteristics of a democracy?",88  which one would you choose as the most essential characteristics of a democracy?,"88 A system like ours, even if it runs into problems, deserves the people's support",88 Which one would you choose as the most essential characteristics of a democracy: Set 4?,other,other,5
q89,,Used force or violence for a political cause,"q89. On the whole, how satisfied or dissatisfied are you with the way democracy works in [Country].  Are you …?",89. which one would you choose as the most essential characteristics of a democracy?,89 I would rather live under our system of government than any other that I can think of.,"89 To you, what does “democracy” mean? (open-ended) <optional>",other,other,5
q92,,People often differ in their views on the characteristic that is essential to democracy. If you have to choose only one of the things,q92. Where would you place our country ten years ago?,"92 On the whole, how satisfied or dissatisfied are you with the way democracy works in the country?",92 Politics is clean and free of corruption,92 Where would you place our country under the present government?,other,other,5
q95,,Where would you place our country during the period of [the name of the most recent government under authoritarian rule]?,"q95. How satisfied or dissatisfied are you with the [name of president, etc. ruling current] government?  Are you …?",95 Where would you place our country ten years ago?,95 Political leaders rule by following their own wisdom rathan than people's preferences to ensure a society's collective welfare,95 Where would you place our country today? Democracy is suitable or not,other,other,5
q96,,Where would you place our country under the present government?,"q96. In your opinion, what are the most important problems facing this country that government should address?",96 Where would you expect our country to be ten years from now?,96 Rule by one party that represents the interests of all classes,96 How satisfied or dissatisfied are you with the current president/government?,other,other,5
q99,,How satisfied or dissatisfied are you with the [name of present] government?,q99. Political parties or candidates in our country have equal access to the mass media during the election period.,99 What are the first most important problems facing this country? 1st,"99 On the whole, how satisfied or dissatisfied are you with the way democracy works in our country?",99 Citizens are able to remove a government they don't like through elections.,other,other,5
q162,,Impression: International Monetary Fund or IMF,,"162 Given the chance, how willing would you be to go and live in another country","162 The following is a hypothetical question: If your family were unfortunate enough to lose its main source of income, how serious would it be for your family?","162 The following is a hypothetical question: If you were unfortunate enough to lose your main source of income, how serious would it be for you and your family?",other,other,4
q163,,Impression: World Bank,,163 Which country has the most influence in Asia?,"163 Considering all the effort that you and your family members have made in the past, do you think the income that your family currently receives is fair or not fair?","163 Considering all the effort that you and your family members have made in the past, do you think the income that your family currently receives is fair or not fair?",other,other,4
q164,,Impression: United States,,164 Does the United States do more good or harm to the region?,"164 As compared to my parent's generation, my generation has more or fewer opportunities to improve one's standard of living or social status?","164 As compared to my parent's generation, my generation has more or fewer opportunities to improve the standard of living or   social status?",other,other,4
q165,,Impression: China,,165 Does China do more good or harm to the region?,165 Will the next generation have had a better or worse life than our generation?,165 Will the next generation have had a better or worse life than our generation?,other,other,4
q166,,Impression: Japan,,"166 In ten years, which country will have the most influence in Asia?",166 How proud are you to be a citizen of the country?,166 How proud are you to be a citizen of (COUNTRY)? Are you...,other,other,4
q52,,"When you get together with your family members or friends, how often do you discuss political matters?","q52. For the sake of national interest, individual interest could be sacrificed.",52. How often do you use the Internet or social media networks to express your opinion about politics and government?,52 Which one is the most important channel for you to find information about politics and government?,,other,other,4
q91,,,q91. Here is a scale: 1 means completely undemocratic and 10 means completely democratic. Where would you place our country under the present government?,91. which one would you choose as the most essential characteristics of a democracy?,91 The courts protects the ordinary people from the abuse of government power,91 In your opinion how much of a democracy is our country?,other,other,4
q157a,,,q157a. Does China do more good or harm to the region?,,157a Do you strongly agree or just agree with the chosen statement?,157a Do you strongly agree or just agree with the chosen statement?,other,other,3
q167,,,,167 Which country should be a model for our own country's future development?,"167 Given the chance, how willing would you be to go and live in another country?","167 Given the chance, how willing would you be to go and live in another country?",other,other,3
q168,,,,168 How much influence does China have on our country?,"168 Under a democratic system, the country endures poor economic performance","168 In order to solve the country’s urgent problems, a leader can govern the country by decrees and disregard the parliament if necessary",other,other,3
q169,,,,"169 General speaking, the influence China has on our country is?",169 Democratic regimes are indecisive and full of problems,"169 As long as a government can solve our country’s economic problem, it does not matter if the government holds regular elections or not",other,other,3
q170,,,,170 How much influence does the United States have on our country?,170 Democratic systems are not effective at maintaining order and stability,170This country needs a leader who can break the rules if necessary to get things done,other,other,3
q171,,,,"171 General speaking, the influence the United States has on our country is?",171 The citizens in our country are not prepared for a democratic system,"171 As long as the government can maintain order and stability in the country, it does not matter whether it is democratic or undemocratic",other,other,3
q119_1,,119_1 Personally witnessed,119_1 Personally witnessed,,,,other,other,2
q119_2,,119_2 Told about it by family member,119_2 Told about it by family member,,,,other,other,2
q119_3,,119_3 Told about it by friend,119_3 Told about it by friend,,,,other,other,2
q147a,A political leader should not tolerate the views of those who challenge his political ideals,,chaotic,,,,other,other,2
q156_1,,,,,156_1 Our country should do more to learn from other countries(q156+q156a),156_1 Our country should do more to learn from other countries(q156+q156a),other,other,2
q156a,,,,,156a Do you strongly agree or just agree with the chosen statement?,156a Do you strongly agree or just agree with the chosen statement?,other,other,2
q157_1,,,,,157_1 Our country should do more trade with other countries(q157+q157a),157_1 Our country should do more trade with other countries(q157+q157a),other,other,2
q172,,,,172 How close do you feel to ASEAN? (ASEAN countries only),172 Democracy negatively affects social and ethical values in our country,,other,other,2
q173,,,,,"173 As long as a government can solve our country's economic problem, it does not matter if it is democratic or not democratic",173 Which country has the most influence in Asia?,other,other,2
q174,,,,,174 Which country has the most influence in Asia?,174 Does USA do more good or harm to the Asia?,other,other,2
q175,,,,,175 Does the United States do more good or harm to Asia?,"175 Generally speaking, the influence the United States today has on world affairs is?",other,other,2
q176,,,,,176 The influence of the U.S. on world affairs today is negative or positive?,176 Does China do more good or harm to the Asia?,other,other,2
q177,,,,,177  Does China do more good or harm to Asia?,"177 Generally speaking, the influence China today has on world affairs is?",other,other,2
q178,,,,,178 The infulece of China on world affairs today is negative or positive?,"178 Generally speaking, the influence the E.U. today has on world affairs is?",other,other,2
q179,,,,,"179 In ten years, which country will have the most influence in Asia?","179  In ten years, which country will have the most influence in Asia?",other,other,2
q180,,,,,180 Which country should be a model for our own country's future development?,180 Which country should be a model for our own country's future development?,other,other,2
q181,,,,,181 How much influence does China have on our country?,181 How much influence does China have on our country?,other,other,2
q182,,,,,"182 General speaking, the influence China has on our country is?","182 Generally speaking, the influence China has on our country is?",other,other,2
q183,,,,,183 How much influence does the United States have on our country?,183 How much influence does USA have on our country?,other,other,2
q184,,,,,"184 General speaking, the influence the United States has on our country is?","184 General speaking, the influence USA has on our country is?",other,other,2
q185,,,,,185 Which aspect about the Asian power's influence and impact you have in mind when answering the above questions?,185 Which aspect of the major power’s influence and impact you have in mind when answering the above questions?,other,other,2
q186,,,,,186 How close do you feel to ASEAN?(ASEAN countries only)?,186 How close do you feel to ASEAN? (ASEAN countries only),other,other,2
q51,,,"q51. In a group, we should sacrifice our individual interest for the sake of the group's collective interest.",51. How often do you use the Internet or social media networks to find information about politics and government?,,,other,other,2
q51a,,From Q51 Which is most important,,,51a You use social media primarily to connect with other people,,other,other,2
q74a,,,q74a. Do you strongly agree or just agree with the chosen statement?,74a Whether you personally have ever got together with others to try to resolve local problems-4 categories,,,other,other,2
q75a,,,q75a. Do you strongly agree or just agree with the chosen statement?,75a Got together with others to raise an issue or sign a petition-4 categories,,,other,other,2
q76a,,,q76a. Do you strongly agree or just agree with the chosen statement?,76a Attended a demonstration or protest march-4 categories,,,other,other,2
q77a,,,q77a. Do you strongly agree or just agree with the chosen statement?,77a Used force or violence for a political cause-4 categories,,,other,other,2
q79a,,,q79a. Do you strongly agree or just agree with the chosen statement?,79a. Do you strongly agree or just agree with the chosen statement?,,,other,other,2
q82a,,,,82a. Do you strongly agree or just agree with the chosen statement?,82a Do you strongly agree or just agree with the chosen statement?,,other,other,2
Q106c,,,,,"106c:(India only) In your opinion, what are the most important problems facing this country that government should address? (1st response)",,other,other,1
Q106d,,,,,"106d:(India only) In your opinion, what are the most important problems facing this country that government should address? (2nd response)",,other,other,1
Q106e,,,,,"106e:(India only) In your opinion, what are the most important problems facing this country that government should address? (3rd response)",,other,other,1
q009,How much trust do you have in political parties?,,,,,,other,other,1
q018_2,TRUST STATE OWNED ENTERPRISES,,,,,,other,other,1
q018_3,TRUST PRIVATE ENTERPRISES,,,,,,other,other,1
q018_4,TRUST FOREIGN ENTERPRISES,,,,,,other,other,1
q018_5,TRUST OUR COUNTRY,,,,,,other,other,1
q018_7,Local MP(q18_1),,,,,,other,other,1
q023,How often do you discuss politics?,,,,,,other,other,1
q024,most people can be trusted??,,,,,,other,other,1
q026,"I have some friends with influence, so I don't have to worry too much if I get into a tight spot",,,,,,other,other,1
q029,Did you attend a campaign meeting or rally?,,,,,,other,other,1
q044,Influential_FAMILY MEMBER/RELATIVE,,,,,,other,other,1
q045,Influential_SENIORS IN A CLAN OR EXTENDED FAMILY,,,,,,other,other,1
q048,Influential_SUPERIOR AT WORK/SCHOOL,,,,,,other,other,1
q049,Influential_OWNERS OF THE FIRM/UNIT THAT YOU WORK FOR,,,,,,other,other,1
q051,Influential_GOVERNMENT OFFICIAL WHOM YOU KNOW PERSONALLY,,,,,,other,other,1
q052,Influential_GOVERNMENT OFFICIAL WHOM YOU DON'T KNOW,,,,,,other,other,1
q053,Influential_CANDIDATE/PARTY ACTIVIST WHOM YOU KNOW PERSONALLY,,,,,,other,other,1
q054,Influential_CANDIDATE/PARTY ACTIVIST WHOM YOU DON'T KNOW,,,,,,other,other,1
q055,Influential_OTHERS,,,,,,other,other,1
q061,How much impact do you feel government policies have on your daily life?,,,,,,other,other,1
q062,party feel closest to,,,,,,other,other,1
q063,closeness,,,,,,other,other,1
q064,"Even if parents' demands are unreasonable, children still should do what they ask?",,,,,,other,other,1
q065,"When hiring someone, even if a stranger is more qualified, the opportunity should still be given to relatives and friend",,,,,,other,other,1
q067,"Wealth and poverty, success and failure are all determined by fate?",,,,,,other,other,1
q068,A person should not insist on his own opinion if his co-workers disagree with him?,,,,,,other,other,1
q069,"For the sake of the family, the individual should put his personal interests second?",,,,,,other,other,1
q070,A man will lose face if he works under a female supervisor?,,,,,,other,other,1
q071,"If there is a quarrel, we should ask an elder to resolve the dispute?",,,,,,other,other,1
q072,"When a mother-in-law and a daughter-in-law come into conflict, even if the mother-in-law is in the wrong, the husband sh",,,,,,other,other,1
q079,"Demonstrated, striken, or sat-in for something?",,,,,,other,other,1
q087,"Did you do this alone or with others?_demonstration, strike, sit-in",,,,,,other,other,1
q095,"Gift or dinner_demonstration, strike, sit-in",,,,,,other,other,1
q097_1,MEANING OF DEMOCRACY FIRST,,,,,,other,other,1
q097_2,MEANING OF DEMOCRACY SECOND,,,,,,other,other,1
q097_3,MEANING OF DEMOCRACY THIRD,,,,,,other,other,1
q099,Where would you place our country on this scale during the period of [name of the most recent government under authoritarian rule]?,,,,,,other,other,1
q102a,,How likely is it that the government will solve the most important problem you identified?,,,,,other,other,1
q106a,,,,,106a What are the most important problems facing this country that government should address(2nd response)?,,other,other,1
q106b,,,,,106b What are the most important problems facing this country that government should address(3rd response)?,,other,other,1
q116e,anyone you know personally witnessed ?,,,,,,other,other,1
q119a,,,,,,119a Did you personally witness it or were you told about it by a family member or friend who personally witnessed? Personally witnessed,other,other,1
q119b,,,,,,119b Did you personally witness it or were you told about it by a family member or friend who personally witnessed? Told about it by a family member who personally witnessed,other,other,1
q119c,,,,,,119c Did you personally witness it or were you told about it by a family member or friend who personally witnessed? Told about it by a friend who personally witnessed,other,other,1
q127a_1,,,,,127a_1 Did you personally witness it or were you told about it by a family member or friend who personally witnessed? personally witnessed,,other,other,1
q127a_2,,,,,127a_2  Did you personally witness it or were you told about it by a family member or friend who personally witnessed? told about it by a family member who personally witnessed,,other,other,1
q127a_3,,,,,127a_3  Did you personally witness it or were you told about it by a family member or friend who personally witnessed? told about it by a friend who personally witnessed,,other,other,1
q129a_q131a,,,sum of Q129a_q131a(reject all authoritarian options),,,,other,other,1
q130a,,,one poltical party,,,,other,other,1
q131a,,,army,,,,other,other,1
q139a,,,,,,139a Did you or a member of your family suffer from serious illness or death?,other,other,1
q139b,,,,,,139b Did you or a member of your family suffer from loss of job,other,other,1
q139c,,,,,,139c Did you or a member of your family suffer from loss of household income?,other,other,1
q139d,,,,,,139d Did you or a member of your family suffer from disruption of my kids' education?,other,other,1
q141a,,,government leader,,,,other,other,1
q141a_q147a,,,average rejection of authoritarian values,,,,other,other,1
q142a,,,certain ideas,,,,other,other,1
q143e,,,,,,143e To impose a lockdown for a long time,other,other,1
q145other,,,,,,145. Other specify responses,other,other,1
q146a,,,political leaders,,,,other,other,1
q157b,,,q157b. Does China do more good or harm to the region? (Whether the most influence country is China or not.),,,,other,other,1
