variable,Wave1,Wave2,Wave3,Wave4,Wave5,Wave6,primary_domain,all_domains,n_waves
q137,"If the government is constantly checked by the legislature, it cannot possibly accomplish great things","When judges decide important cases, they should accept the view of the executive branch","q137. A citizen should always remain loyal only to his country, no matter how imperfect it is or what wrong it has done.",137 You can generally trust the people who run our government to do what is right.,137 We should get rid of parliament and elections and have a strong leader decide things.,"137 A citizen should always remain loyal only to his country, no matter how imperfect it is or what wrong it has done.",accountability,accountability; legislature,6
q160a,,,,,160a It is the responsibility of the government to narrow the gap between the rich and the poor,160a Narrow the gap between the rich and the poor,accountability,accountability,2
q160b,,,,,160b It is the responsibility of the government to make sure that everyone has affordable housing,160b Make sure that everyone has affordable housing,accountability,accountability,2
q160c,,,,,160c It is the responsibility of the government to make sure that everyone has access to basic medical care,160c Make sure that everyone has access to basic medical care,accountability,accountability,2
q160d,,,,,160d It is the responsibility of the government to make sure that basic necessitities such as food and shelters are provided for everyone,160d Make sure that basic necessities such as food and shelters are provided for everyone,accountability,accountability,2
q145a,,,checked by the legislature,,,,accountability,accountability; legislature,1
q123,The military should come in to govern the country,"If you had to choose between democracy and economic development, which would you say is more important?",q123. Where would you place India today on this scale?,123 Where would you place Japan on this scale?,123 How capable is the government of enforcing laws and implementing policies?,123 Where would you place India today on this scale?,authoritarianism,authoritarianism,6
q129a,,,strong leader,,,,authoritarianism,authoritarianism,1
q113,You can join any organization you like- is better than before?,How often do national government officials abide by the law? (HK: Hong Kong government),q113. How well do you think the government responds to what people want?,113 How often do you think our elections offer the voters a real choice between different parties/candidates?,113 Rich and poor people are treated equally by the government,113 How much do you feel that having elections make the government more responsive to people's needs?,civil_society,civil_society,6
q19,,Trust in NGOs,q19. Non-governmental organizations or NGOs <Optional>,19 Non-government organizations or NGOs,19. Name of the organization you belong to. Second,19 Name of the organization you belong to. Second,civil_society,civil_society,5
q20,,Are you a member of any organization or formal groups?,q20. Could you identity the three most important organizations or formal groups you belong to. First Organization,20. Name of the organization you belong to. First,20. Name of the organization that you belong to. Third,20 Name of the organization that you belong to. Third,civil_society,civil_society,5
q82,,Contacted officials of political parties or other political organizations,"q82. A system like ours, even if it runs into problems, deserves the people's support.",82. which of the following statements do you agree with most?,82 which of the following statements do you agree with most?government leaders vs.their citizens,"82  A system like ours, even if it runs into problems, deserves the people's support.",civil_society,civil_society; social_capital,5
q83,,Contacted representative of non-government/civil society organizations,q83. I would rather live under our system of government than any other that I can think of.,"83. Over the long run, our system of government is capable of solving the problems our country faces",83 Which of the following statements do you agree with most? the problem of accountability,83  I would rather live under our system of government than any other that I can think of.,civil_society,civil_society; social_capital,5
q21,,,q21. Second Organization,21. Name of the organization you belong to. Second,21  Which organization you participate most actively in the last 12 months?,21 Which organization you participate most actively in the last 12 months?',civil_society,civil_society,4
q22,,,q22. Third Organization,22. Name of the organization that you belong to. Third,"22 Would you say that ""Most people can be trusted"" or ""that you must be very careful in dealing with people""?",22 Would you say that 'Most people can be trusted' or 'that you must be very careful in dealing with people'?,civil_society,civil_society,4
q050,Influential_MEMBER/OFFICIAL OF ORGANIZATION THAT YOU BELONG TO,,,,,,civil_society,civil_society,1
q076,Contacted political parties or other political organizations?,,,,,,civil_society,civil_society; social_capital,1
q077,Contacted non-government/civil society organizations?,,,,,,civil_society,civil_society; social_capital,1
q084,Did you do this alone or with others?_contacted political parties or other political organizations,,,,,,civil_society,civil_society; social_capital,1
q085,Did you do this alone or with others?_ contacted non-government/civil society organizations,,,,,,civil_society,civil_society; social_capital,1
q092,Gift or dinner_contacted political parties or other political organizations,,,,,,civil_society,civil_society; social_capital,1
q093,Gift or dinner_contacted non-goverment/civil society organizations,,,,,,civil_society,civil_society; social_capital,1
q20_1,,First organization,,,,,civil_society,civil_society,1
q20_2,,Second organization,,,,,civil_society,civil_society,1
q20_3,,Third organization,,,,,civil_society,civil_society,1
q108,Corruption in politics and government is under control- is better than before?,Everyone is treated equally by the government,q108. Do officials who commit crimes go unpunished?,108. People are free to speak what they think without fear.,108 Citizens are able to remove a government they don't like through elections,108 How often do government officials withhold important information from the public?,corruption,corruption,6
q114,How widespread corruption in your local/municipal government?,How often do your think our elections offer the voters a real choice between different parties/candidates?,"q114. In your neighborhood or community, do people voice their interests and concerns in local affairs?",114 To what extent is the legislature capable of keeping government leaders in check?,"114 People have basic necessities like food, clothes, and shelter",114 How capable is the government of enforcing laws and implementing policies?,corruption,corruption; local_government,6
q115,How widespread corruption in the national government?,To what extent is the legislature capable of keeping the government in check?,q115. How much do you feel that having elections makes the government pay attention to what the people think?,115 How well do you think the government responds to what people want?,115 People are free to speak what they think without fear,115 How widespread do you think corruption and bribe-taking are in your local/municipal government?,corruption,corruption,6
q116,anyone you know personally witnessed an act of corruption?,How well do you think the government responds to what people want?,q116. How widespread do you think corruption and bribe-taking are in your local/municipal government?  Would you say …?,116 How much do you feel that having elections makes the government pay attention to what the people think?,116 People can join any organization they like without fear,116 How widespread do you think corruption and bribe-taking are in the national government?,corruption,corruption,6
q018_9,The Corruption Commission(q18_3),,,,,,corruption,corruption,1
q172c,,,,,,172c Widespread corruption that the president [PM] claims can only be reduced by increasing executive power,corruption,corruption,1
q172a,,,,,,172a Which circumstance would justify the governments's use of emergency powers to costrain rights and freedom: A public health crisis like the Covid-19 pandemic,covid,covid,1
q101,To what extent would you want our country to be democratic now?,Second Response,"q101. When government leaders break the laws, there is nothing the court can do.",101. People have the power to change a government they don't like,101 Where would you place our country under the present government?,"101  Between elections, the people have no way of holding the government responsible for its actions.",democracy_level,democracy_level,6
q94,,In your opinion how much of a democracy is [country]?,"q94. Here is a similar scale of 1 to 10 measuring the extent to which people think democracy is suitable for our country. If ""1"" means that democracy is completely unsuitable for [name of country] today and ""10"" means that it is completely suitable, where",94 Where would you place our country under the present government?,"94 When making laws, the government seek advice from religious authorities",94 Where would you expect our country to be ten years from now?,democracy_level,democracy_level,5
q97,,To what extent would you want our country to be democratic now?,q97. How likely is it that the government will solve the most important problem you identified within the next five years? [Read out options],97 Whether you think democracy is suitable for our country,97 Qualified candidates are pre-selected by religious leaders,97 What are the most important problems facing this country that government should address? First,democracy_level,democracy_level,5
q93,,"On the whole, how satisfied or dissatisfied are you with the way democracy works in [country]?",q93. Where would you want our country to be in the future?,93. In your opinion how much of a democracy is the country?,93 People have the freedom to take part in protests and demonstrations,93 Where would you place our country ten years ago?,democracy_satisfaction,democracy_satisfaction,5
q098,Satisfaction with the way democracy works in our country?,,,,,,democracy_satisfaction,democracy_satisfaction,1
q103,Do you think democracy is suitable for our country?,People have the power to change a government they don't like,q103. All citizens from different ethnic communities in Country X are treated equally by the government.,"103. Between elections, the people have no way of holding the government responsible for its actions.",103 Where would you expect our country to be ten years from now?,103  All citizens from different ethnic communities in the [Country X] are treated equally by the government.,democracy_support,democracy_support,6
q98,,Which would you think democracy is suitable for our country?,"q98. Now I am going to read to you a list of statements that describe how people often feel about the state of affairs in [country name]. Please tell me whether you strongly agree, somewhat agree, somewhat disagree, or strongly disagree with each of these",98 How satisfied or dissatisfied are you with the current government?,"98 If you have to choose only one, which of the following you think is the most essential element of a democracy?",98 How likely is it that the government will solve the most important problem you identified within the next five years?,democracy_support,democracy_support,5
q111,Economic development- is better than before?,People can join any organization the like without fear,q111.  How often do you think our elections offer the voters a real choice between different parties/candidates?,111 How often do government officials withhold important information from the public view?,"111 When government leaders break the laws, there is nothing the court can do",111 To what extent is the legislature capable of keeping government leaders in check?,economic_evaluation,economic_evaluation,6
q1,,How would you rate the overall economic condition of our country today?,q1. How would you rate the overall economic condition of our country today?  Is it …,1. How would you rate the overll economic condition of our country today?,1. How would you rate the overall economic condition of our country today?,1 How would you rate the overall economic condition of our country today?,economic_evaluation,economic_evaluation,5
q2,,How would you describe the change in the economic condition of our country over the last years?,q2. How would you describe the change in the economic condition of our country over the last few years,2. How would you dsecribe the change in the economic condition of our country over the last few years?,2. How would you dsecribe the change in the economic condition of our country over the last few years?,2 How would you describe the change in the economic condition of our country over the last few years?,economic_evaluation,economic_evaluation,5
q3,,What do you think will be the state of our country's economic condition a few years from now?,q3. What do you think will be the state of our country's economic condition a few years from now? Will it be …,3. What do you think will be the state of our country's economic condition a few years from now?,3. What do you think will be the state of our country's economic condition a few years from now?,3 What do you think will be the state of our country's economic condition a few years from now?,economic_evaluation,economic_evaluation,5
q4,,"As for your own family, how do you rate your economic situation today?","q4. As for your own family, how do you rate the economic situation of your family today?  Is it …","4. As for your own family, how do you rate the economic situation of your family today?","4. As for your own family, how do you rate the economic situation of your family today?","4 As for your own family, how do you rate the economic situation of your family today?",economic_evaluation,economic_evaluation,5
q5,,How would you compare the current economic condition of your family with what it was a few years ago?,q5. How would you compare the current economic condition of your family with what it was a few years ago? Is it …,5. How would you compare the current economic condition of your family with what it was a few years ago?,5. How would you compare the current economic condition of your family with what it was a few years ago?,5 How would you compare the current economic condition of your family with what it was a few years ago?,economic_evaluation,economic_evaluation,5
q6,,What do you think the economic situation of your family will be a few years from now?,q6. What do you think the economic situation of your family will be a few years from now? Will it be …,6. What do you think the economic situation of your family will be a few years from now?,6. What do you think the economic situation of your family will be a few years from now?,6 What do you think the economic situation of your family will be a few years from now?,economic_evaluation,economic_evaluation,5
q001,How would you rate the overall economic condition of our country today?,,,,,,economic_evaluation,economic_evaluation,1
q002,How would you describe the change in the economic condition of our country over the past five years?,,,,,,economic_evaluation,economic_evaluation,1
q003,What do you think will be the state of our country's economic condition five years from now?,,,,,,economic_evaluation,economic_evaluation,1
q004,"As for your own family, how do you rate your economic situation today?",,,,,,economic_evaluation,economic_evaluation,1
q005,How would you compare the current economic condition of your family with what it was five years ago?,,,,,,economic_evaluation,economic_evaluation,1
q006,What do you think the economic situation of your family will be five years from now?,,,,,,economic_evaluation,economic_evaluation,1
q106,Everyone is treated equally by the government- is better than before?,"Between elections, the people have no way of holding the government responsible for its actions",q106. People are free to speak what they think without fear.,106 Rich and poor people are treated equally by the government,106 What are the first most important problems facing this country that government should address(1st response)?,106  People are free to speak what they think without fear.,equality,equality,6
q143b,,,,,,143b To limit freedom of speech or assembly,freedom_assembly,freedom_assembly; legislature,1
q105,Everyone is free to say what they think- is better than before?,Political parties or candidates in our country have equal access to the mass media during the election period,"q105. People have basic necessities like food, clothes, and shelter.",105. All citizens from different ethnic communities in the country are treated equally by the government.,105 How satisfied or dissatisfied are you with the current president/government?,"105  People have basic necessities like food, clothes, and shelter.",freedom_expression,freedom_expression,6
q128,The nation is run by a powerful few and ordinary citizens cannot do much about it,Sometimes politics and government seems so complicated that a person like me can't really understand what is going on,"q128. Do you agree or disagree with the following statement: ""Democracy may have its problems, but it is still the best form of government.""","128 If you had to choose between reducing economic inequality and protecting political freedom, which would you say is more important?",128 Where would you place China today on this scale?,"128 Do you agree or disagree with the following statement: 'Democracy may have its problems, but it is still the best form of government's?",identity,identity,6
q150,,Their basic well-being should be taken care of by the government to the same extent as other citizens,"q150. How often do you watch or listen to foreign programs (television, DVDs, movies, radio)?",150 How closely do you follow major events in foreign countries/ the world?,150 The government should decide whether certain ideas should be allowed to be discussed in society,150 The government should decide whether certain ideas should be allowed to be discussed in society.,identity,identity,5
q152,,"Citizens should always obey laws and regulations, even if they disagree with them","q152. Do you agree or disagree with the following statement: ""We should protect our farmers and workers by limiting the import of foreign goods.""","152 Do you agree or disagree with the following statement: ""We should protect our farmers and workers by limiting the import of foreign goods.""","152 When judges decide important cases, they should accept the view of the executive branch","152 When judges decide important cases, they should accept the view of the executive branch.",identity,identity,5
q153,,"Do you agree or disagree with the following statement: ""A citizen should always remain loyal only to his country, no matter how imperfect","q153. Do you agree or disagree with the following statement: ""Foreign goods are hurting the local community.""",153 Do you think the government should increase or decrease the inflow of foreign immigrants into the country?,"153 If the government is constantly checked [i.e. monitored and supervised] by the legislature, it cannot possibly accomplish great things","153 If the government is constantly checked by the legislature, it cannot possibly accomplish great things.",identity,identity,5
q154,,How proud are you to be a citizen of [Country],q154. How proud are you to be a citizen of (COUNTRY)?,154 Which of these statements comes closer to your view?,"154 If we have political leaders who are morally upright, we can let them decide everything","154 If we have political leaders who are morally upright, we can let them decide everything.",identity,identity,5
q143d,,,,,,143d To track citizens’ locations at all times,identity,identity,1
q112,Judges and courts are free from political interference- is better than before?,How often do government officials withhold important information from the public view?,q112. To what extent is the legislature capable of keeping government leaders in check?,112 How often do you think government leaders break the law or abuse their power?,112 All citizens from different ethnic communities in the country are treated equally by the government.,112 How well do you think the government responds to what people want?,judiciary,judiciary,6
q136,"When judges decide important cases, they should accept the view of the executive branch",Harmony of the community will be disrupted if people organize lots of groups,q136. You can generally trust the people who run our government to do what is right.,136 People like me don't have any influence over what the government does.,"136 Do you agree or disagree with the following statement: ""Democracy may have its problems, but it is still the best form of government"".",136 You can generally trust the people who run our government to do what is right.,judiciary,judiciary,6
q018_8,The Constitution Court(q18_2),,,,,,judiciary,judiciary,1
q144a,,,judges,,,,judiciary,judiciary,1
q135,Harmony of the community will be disrupted if people organize lots of groups,The government should decide whether certain ideas should be allowed to be discussed in society,q135. People like me don't have any influence over what the government does.,135 Sometimes politics and government seems so complicated that a person like me can't really understand what is going on.,"135 If you had to choose between reducing economic inequality and protecting political freedom, which would you say is more important?",135 People like me don't have any influence over what the government does.,local_government,local_government,6
q143,"For the sake of the national community/society, the individual should be prepared to sacrifice his personal interest",The local government should have more authority over local decisions than it does now,q143. Harmony of the community will be disrupted if people organize lots of groups.,143 The government should decide whether certain ideas should be allowed to be discussed in society,143 People like me don`t have any influence over what the government does,,local_government,local_government,5
q156,,Relation: The European Community or European Union,q156. Which country has the most influence in Asia?,156 It is the responsibility of the government to reduce the differences between people with high income and those with low incomes.,156 Which of the following statements do you agree with the most? distinct way of life vs. learning from other countries,156 Choose one statement.,local_government,local_government,5
q32,,"Generally speaking, how safe is living in this city/town/village?","q32. In talking to people about elections, we often find that a lot of people were not able to vote because they were away from home, they were sick or they just didn't have time. How about you? Did you vote in the election [the most recent national elect","32 If you had friends or co-workers whose opinions on politics differed from yours, would you have a hard time conversing with them?","32 If you had friends or co-workers whose opinions on politics differed from yours, would you have a hard time conversing with them?","32 If you had friends or co-workers whose opinions on politics differed from yours, would you have a hard time conversing with them?",local_government,local_government,5
q33,,"Compared to the situation in this city/town/village a few years ago, do you feel more safe, less safe or the same as before?",q33. Which parties (or candidates for president if it was presidential race) did you vote for? [country-specific response grid],33 Did you vote in the last national election?,33 Did you vote in the last national election?,33 Did you vote in the national election?,local_government,local_government,5
q76,,"For the sake of the national community/society, the individual should be prepared to sacrifice","q76. Let's talk for a moment about the kind of government you would like to have in this country, which of the followings statements do you agree with most? Choose the first or the second statement. [Interviewer: Probe whether respondent strongly agrees o",76 Attended a demonstration or protest march-3 categories,76 Used the internet including social media networks to express opinions about politics and government,76  Attended a demonstration or protest march,local_government,local_government,5
q160,,Impression: The European Community or European Union,q160. How much influence does China have on our country?,"160 As compared to my parent's generation, my generation has more or fewer opportunities to improve one's standard of living or social status?",,,local_government,local_government,3
q143a,,,Harmony of the community,,,"143aWhen there is a public health challenge like the coronavirus, is it justifiable for the government to postpone elections?",local_government,local_government,2
q047,Influential_COMMUNITY LEADERS,,,,,,local_government,local_government,1
q71a,,,,71a Contacted traditional leaders/community leaders-4 categories,,,local_government,local_government; traditional_values; social_capital,1
q16,,Trust in newspaper,q16. Newspapers,16 Newspaper,16 The election commission,16 The election commission,media,media,5
q17,,Trust in television,q17. Television,17 Television,17 Non-government organizations or NGOs,17 Non-government organizations or NGOs,media,media,5
