variable,label_clean,label,wave,value_labels_sample,n_waves,cluster_id,domains,primary_domain,all_domains
q51_1,main source of information question 51 01 television,Main source of information. Question 51.01 Television,Wave2,Not applicable = 0; Yes = 1; No = 2,1,-1,['media'],media,media
q51_2,question 51 02 newspaper,Question 51.02 Newspaper,Wave2,Not applicable = 0; Yes = 1; No = 2,1,-1,['media'],media,media
q51_3,question 51 03 radio,Question 51.03 Radio,Wave2,Not applicable = 0; Yes = 1; No = 2,1,-1,['media'],media,media
q51_4,question 51 04 internet,Question 51.04 Internet,Wave2,Not applicable = 0; Yes = 1; No = 2,1,-1,['media'],media,media
q51a_Facebook,a which social media and text messaging services do you actively use facebook,51a Which social media and text messaging services do you actively use? Facebook,Wave6,Missing = -1; Not applicable = 0; Yes = 1,1,-1,['media'],media,media
q51b,b you use social media primarily to expresss my opinion on political issues,51b You use social media primarily to expresss my opinion on political issues,Wave5,Missing = -1; Not applicable = 0; Yes = 1,1,-1,['media'],media,media
q51c,c you use social media primarily to share news or information,51c You use social media primarily to share news or information,Wave5,Missing = -1; Not applicable = 0; Yes = 1,1,-1,['media'],media,media
q51d,d you use social media primarily for work,51d You use social media primarily for work,Wave5,Missing = -1; Not applicable = 0; Yes = 1,1,-1,['media'],media,media
q52a,a how often do you use social media to talk to or to connect with other people,52a How often do you use social media to talk to or to connect with other people?,Wave6,Missing = -1; Not applicable = 0; Often = 1,1,-1,['media'],media,media
q52b,b how often do you use social media to express my opinion on political issues,52b How often do you use social media to express my opinion on political issues?,Wave6,Missing = -1; Not applicable = 0; Often = 1,1,-1,['media'],media,media
q52c,c how often do you use social media to share news or information,52c How often do you use social media to share news or information?,Wave6,Missing = -1; Not applicable = 0; Often = 1,1,-1,['media'],media,media
q52d,d how often do you use social media to organize to influence politics,52d How often do you use social media to organize to influence politics?,Wave6,Missing = -1; Not applicable = 0; Often = 1,1,-1,['media'],media,media
q73a,a contacted news media 4 categories,73a  Contacted news media-4 categories,Wave4,Missing = -1; I have done this more than once = 1; I have done this once = 2,1,-1,"['media', 'social_capital']",media,media; social_capital
q100,where would you place our country under the present government,Where would you place our country under the present government?,"Wave1, Wave2, Wave3, Wave4, Wave5, Wave6",Complete dictatorship = 1; Complete democracy = 10; Not Applicable = 97,6,-1,['other'],other,other
q102,where do you expect our country to be in five years,Where do you expect our country to be in five years?,"Wave1, Wave2, Wave3, Wave4, Wave5, Wave6",Complete dictatorship = 1; Complete democracy = 10; Not Applicable = 97,6,-1,['other'],other,other
q104,how satisfied or dissatisfied are you with the current government,How satisfied or dissatisfied are you with the current government?,"Wave1, Wave2, Wave3, Wave4, Wave5, Wave6",Veryl dissatisfied = 1; Somewhat dissatisfied = 2; Somewhat satisfied = 3,6,-1,['other'],other,other
q109,the gap between the rich and the poor have narrowed is better than before,The gap between the rich and the poor have narrowed- is better than before?,"Wave1, Wave2, Wave3, Wave4, Wave5, Wave6",Much worse = 1; Somewhat worse = 2; Much the same = 3,6,-1,['other'],other,other
q110,preventing crime and maintaining order is better than before,Preventing crime and maintaining order- is better than before?,"Wave1, Wave2, Wave3, Wave4, Wave5, Wave6",Much worse = 1; Somewhat worse = 2; Much the same = 3,6,-1,['other'],other,other
q117,which comes closest to your own opinion,Which comes closest to your own opinion?,"Wave1, Wave2, Wave3, Wave4, Wave5, Wave6",Authoritarian government can be preferable = 1; Does not matter whether we have a non_or_democratic regime = 2; Democracy: preferable to any other kind of government = 3,6,-1,['other'],other,other
q118,which comes closer to your own view,Which comes closer to your own view?,"Wave1, Wave2, Wave3, Wave4, Wave5, Wave6",Democracy can not solve our society's problems = 1; Democracy is capable of solving the problems of our society = 2; Don't know = 98,6,-1,['other'],other,other
q120,which comes closer to your own view,Which comes closer to your own view?,"Wave1, Wave2, Wave3, Wave4, Wave5, Wave6", It is essential that the country remains one nation = 1; Parts of the country possibly be separate states = 2; Can't choose = 3,6,-1,['other'],other,other
q122,no opposition party should be allowed to compete for power,No opposition party should be allowed to compete for power,"Wave1, Wave2, Wave3, Wave4, Wave5, Wave6",Strongly agree = 1; Somewhat agree = 2; Somewhat disagree = 3,6,-1,['other'],other,other
q125,it is ok for the government to disregard the law in order to deal with the situation when the country is facing a diffi,"It is ok for the government to disregard the law in order to deal with the situation, when the country is facing a diffi","Wave1, Wave2, Wave3, Wave4, Wave5, Wave6",Strongly agree = 1; Somewhat agree = 2; Somewhat disagree = 3,6,-1,['other'],other,other
q127,politics and government seems so complicated that a person like me can t really understand what is going on,Politics and government seems so complicated that a person like me can't really understand what is going on,"Wave1, Wave2, Wave3, Wave4, Wave5, Wave6",Strongly agree = 1; Somewhat agree = 2; Somewhat disagree = 3,6,-1,['other'],other,other
q130,our form of government is still the best for us,Our form of government is still the best for us,"Wave1, Wave2, Wave3, Wave4, Wave5, Wave6",Strongly agree = 1; Somewhat agree = 2; Somewhat disagree = 3,6,-1,['other'],other,other
q132,people with little or no education should have as much say in politics as highly educated people,People with little or no education should have as much say in politics as highly-educated people,"Wave1, Wave2, Wave3, Wave4, Wave5, Wave6",Strongly disagree = 1; Somewhat disagree = 2; Somewhat agree = 3,6,-1,['other'],other,other
q133,government leaders are like the head of a family we should all follow their decisions,Government leaders are like the head of a family; we should all follow their decisions,"Wave1, Wave2, Wave3, Wave4, Wave5, Wave6",Strongly agree = 1; Somewhat agree = 2; Somewhat disagree = 3,6,-1,['other'],other,other
q134,the government should decide whether certain ideas should be allowed to be discussed in society,The government should decide whether certain ideas should be allowed to be discussed in society,"Wave1, Wave2, Wave3, Wave4, Wave5, Wave6",Strongly agree = 1; Somewhat agree = 2; Somewhat disagree = 3,6,-1,['other'],other,other
q140,the government should maintain ownership of major state owned enterprises,The government should maintain ownership of major state-owned enterprises,"Wave1, Wave2, Wave3, Wave4, Wave5, Wave6",Strongly agree = 1; Somewhat agree = 2; Somewhat disagree = 3,6,-1,['other'],other,other
q141,the national government should have more authority over local decisions than it does now,The national government should have more authority over local decisions than it does now,"Wave1, Wave2, Wave3, Wave4, Wave5, Wave6",Strongly agree = 1; Somewhat agree = 2; Somewhat disagree = 3,6,-1,['other'],other,other
q142,our country should defend our way of life instead of becoming more and more like other countries,Our country should defend our way of life instead of becoming more and more like other countries,"Wave1, Wave2, Wave3, Wave4, Wave5, Wave6",Strongly disagree = 1; Somewhat disagree = 2; Somewhat agree = 3,6,-1,['other'],other,other
q144,the state is like a big machine and the individual is but a small cog with no independent status,"The state is like a big machine and the individual is but a small cog, with no independent status","Wave1, Wave2, Wave3, Wave4, Wave5, Wave6",Strongly agree = 1; Somewhat agree = 2; Somewhat disagree = 3,6,-1,['other'],other,other
q145,the most important thing for a political leader is to accomplish his goals even if he has to ignore the established proc,The most important thing for a political leader is to accomplish his goals even if he has to ignore the established proc,"Wave1, Wave2, Wave3, Wave4, Wave5, Wave6",Strongly agree = 1; Somewhat agree = 2; Somewhat disagree = 3,6,-1,['other'],other,other
q146,if a political leader really believes in his position he should refuse to compromise regardless of how many people disa,"If a political leader really believes in his position, he should refuse to compromise regardless of how many people disa","Wave1, Wave2, Wave3, Wave4, Wave5, Wave6",Strongly agree = 1; Somewhat agree = 2; Somewhat disagree = 3,6,-1,['other'],other,other
q147,a political leader should tolerate the views of those who challenge his political ideals,A political leader should tolerate the views of those who challenge his political ideals,"Wave1, Wave2, Wave3, Wave4, Wave5, Wave6",Strongly disagree = 1; Somewhat disagree = 2; Somewhat agree = 3,6,-1,['other'],other,other
q10,trust in political parties,Trust in Political parties,"Wave2, Wave3, Wave4, Wave5, Wave6",None at all = 1; Not Very Much Trust = 2; Quite a Lot of Trust = 3,5,-1,['other'],other,other
q119,choose between democracy and economic development,choose between democracy and economic development?,"Wave1, Wave2, Wave3, Wave4, Wave5",Economic development is definitely more important = 1; Economic development is somewhat more important = 2; Democracy is somewhat more important = 3,5,-1,['other'],other,other
q139,if people have too many different ways of thinking society will be chaotic,"If people have too many different ways of thinking, society will be chaotic","Wave1, Wave2, Wave3, Wave4, Wave5",Strongly agree = 1; Somewhat agree = 2; Somewhat disagree = 3,5,-1,['other'],other,other
q155,given the chance how willing would you be to go and live in another country,"Given the chance, how willing would you be to go and live in another country?","Wave2, Wave3, Wave4, Wave5, Wave6",Very willing = 1; Willing = 2; Not willing = 3,5,-1,['other'],other,other
q157,relation the united nations or un,Relation: The United Nations or UN,"Wave2, Wave3, Wave4, Wave5, Wave6",Yes = 1; No = 2; Decline to answer = 9,5,-1,['other'],other,other
q158,relation international monetary fund or imf,Relation: International Monetary Fund or IMF,"Wave2, Wave3, Wave4, Wave5, Wave6",Yes = 1; No = 2; Decline to answer = 9,5,-1,['other'],other,other
q159,relation world bank,Relation: World Bank,"Wave2, Wave3, Wave4, Wave5, Wave6",Yes = 1; No = 2; Decline to answer = 9,5,-1,['other'],other,other
q161,impression the united nations or un,Impression: The United Nations or UN,"Wave2, Wave3, Wave4, Wave5, Wave6",Very Bad = 1; ... = 2; ... = 3,5,-1,['other'],other,other
q23,general speaking would you say most people can be trusted or that you must be very careful,"General speaking, would you say ""Most people can be trusted"" or ""that you must be very careful""?","Wave2, Wave3, Wave4, Wave5, Wave6",You must be very careful in dealing with people = 1; Most people can be trusted = 2; Do not understand the question = 7,5,-1,['other'],other,other
q31,would you have a hard time conversing with your friends or co workers about politics if you had differing opinions,Would you have a hard time conversing with your friends or co-workers about politics if you had differing opinions?,"Wave2, Wave3, Wave4, Wave5, Wave6",Very hard = 1; A bit hard = 2; Not too hard = 3,5,-1,['other'],other,other
q34,have you been a victim of car motorcycle or bicycle theft,"Have you been a victim of car, motorcycle or bicycle theft?","Wave2, Wave3, Wave4, Wave5, Wave6",Do not own any kind of vehicle = 0; No = 1; Yes = 2,5,-1,['other'],other,other
q35,have you been a victim of pick pocketing robbery of personal property,Have you been a victim of pick-pocketing/robbery of personal property?,"Wave2, Wave3, Wave4, Wave5, Wave6",Not applicable = 0; No = 1; Yes = 2,5,-1,['other'],other,other
q36,have you been a victim of break in at your home,Have you been a victim of break-in at your home?,"Wave2, Wave3, Wave4, Wave5, Wave6",Not applicable = 0; No = 1; Yes = 2,5,-1,['other'],other,other
q37,have you been a victim of physical violence,Have you been a victim of physical violence?,"Wave2, Wave3, Wave4, Wave5, Wave6",Not applicable = 0; No = 1; Yes = 2,5,-1,['other'],other,other
q40,attend a campaign meeting or rally,Attend a campaign meeting or rally,"Wave2, Wave3, Wave4, Wave5, Wave6",Not applicable = 0; No = 1; Yes = 2,5,-1,['other'],other,other
q44,how easy is it to obtain an identity document,How easy is it to obtain: An identity document,"Wave2, Wave3, Wave4, Wave5, Wave6",Not applicable = 0; Very Difficult = 1; Difficult = 2,5,-1,['other'],other,other
q45,how easy is it to obtain a place in public primary school for a child,How easy is it to obtain: A place in public primary school for a child,"Wave2, Wave3, Wave4, Wave5, Wave6",Not applicable = 0; Very Difficult = 1; Difficult = 2,5,-1,['other'],other,other
q46,how easy is it to obtain medical treatment at a nearby clinic,How easy is it to obtain: Medical treatment at a nearby clinic,"Wave2, Wave3, Wave4, Wave5, Wave6",Not applicable = 0; Very Difficult = 1; Difficult = 2,5,-1,['other'],other,other
q48,how would you describe the present political situation in our country,How would you describe the present political situation in our country,"Wave2, Wave3, Wave4, Wave5, Wave6",Very good = 1; Good = 2; Average = 3,5,-1,['other'],other,other
q53,how much impact do you feel government politics have on your daily life,How much impact do you feel government politics have on your daily life?,"Wave2, Wave3, Wave4, Wave5, Wave6",No impact at all = 1; A little impact = 2; Quite some impact = 3,5,-1,['other'],other,other
q54,among the political parties listed here which party if any do you feel closest to,"Among the political parties listed here, which party if any do you feel closest to?","Wave2, Wave3, Wave4, Wave5, Wave6",Cannot choose = 95; Decline to answer = 96; Do not know = 97,5,-1,['other'],other,other
q55,how close do you feel to the party answer in q54,How close do you feel to the party(answer in Q54)?,"Wave2, Wave3, Wave4, Wave5, Wave6",Not applicable = 0; Just a little close = 1; Somewhat close = 2,5,-1,['other'],other,other
q56,even if parents demands are unreasonable children still should do what they ask,"Even if parents' demands are unreasonable, children still should do what they ask","Wave2, Wave3, Wave4, Wave5, Wave6",Strongly agree = 1; Somewhat agree = 2; Somewhat disagree = 3,5,-1,['other'],other,other
q57,being a student one should not question the authority of their teacher,"Being a student, one should not question the authority of their teacher","Wave2, Wave3, Wave4, Wave5, Wave6",Strongly agree = 1; Somewhat agree = 2; Somewhat disagree = 3,5,-1,['other'],other,other
q59,a person should not insist on his own opinion if his co workers disagree with him,A person should not insist on his own opinion if his co-workers disagree with him,"Wave2, Wave3, Wave4, Wave5, Wave6",Strongly agree = 1; Somewhat agree = 2; Somewhat disagree = 3,5,-1,['other'],other,other
q60,for the sake of the family the individual should put his personal interests second,"For the sake of the family, the individual should put his personal interests second","Wave2, Wave3, Wave4, Wave5, Wave6",Strongly agree = 1; Somewhat agree = 2; Somewhat disagree = 3,5,-1,['other'],other,other
q61,sometimes one has to follow one s own beliefs regardless of what other people think,Sometimes one has to follow one's own beliefs regardless of what other people think,"Wave2, Wave3, Wave4, Wave5, Wave6",Strongly agree = 1; Somewhat agree = 2; Somewhat disagree = 3,5,-1,['other'],other,other
q63,open quarrels criticisms among politicians are harmful to society,Open quarrels (criticisms) among politicians are harmful to society,"Wave2, Wave3, Wave4, Wave5, Wave6",Strongly agree = 1; Somewhat agree = 2; Somewhat disagree = 3,5,-1,['other'],other,other
q64,the relationship between the government and the people should be like that between parents and children,The relationship between the government and the people should be like that between parents and children,"Wave2, Wave3, Wave4, Wave5, Wave6",Strongly agree = 1; Somewhat agree = 2; Somewhat disagree = 3,5,-1,['other'],other,other
q67,how closely do you follow major events in foreign countries the world,How closely do you follow major events in foreign countries/the world?,"Wave2, Wave3, Wave4, Wave5, Wave6",Very closely = 1; Somewhat closely = 2; Not too closely = 3,5,-1,['other'],other,other
q68,have you traveled abroad before if you have how often do you travel abroad,"Have you traveled abroad before? If you have, how often do you travel abroad?","Wave2, Wave3, Wave4, Wave5, Wave6",A few times a year = 1; Almost once a year = 2; Just a few times in my whole life = 3,5,-1,['other'],other,other
q70,we should give up gains in the present for the possibility of larger gains in the future,We should give up gains in the present for the possibility of larger gains in the future,"Wave2, Wave3, Wave4, Wave5, Wave6",Strongly agree = 1; Somewhat agree = 2; Somewhat disagree = 3,5,-1,['other'],other,other
q71,conflict among political groups is not a bad thing for our country,Conflict among political groups is not a bad thing for our country,"Wave2, Wave3, Wave4, Wave5, Wave6",Strongly agree = 1; Somewhat agree = 2; Somewhat disagree = 3,5,-1,['other'],other,other
q73,the best way to deal with complicated political issues should be to leave them to the future,The best way to deal with complicated political issues should be to leave them to the future,"Wave2, Wave3, Wave4, Wave5, Wave6",Strongly agree = 1; Somewhat agree = 2; Somewhat disagree = 3,5,-1,['other'],other,other
q74,political reform should be introduced little by little instead of all at once,Political reform should be introduced little-by-little instead of all-at-once,"Wave2, Wave3, Wave4, Wave5, Wave6",Strongly agree = 1; Somewhat agree = 2; Somewhat disagree = 3,5,-1,['other'],other,other
q77,the most important thing for political leaders is to accomplish their goals even if they have to ignore the established procedure,The most important thing for political leaders is to accomplish their goals even if they have to ignore the established procedure,"Wave2, Wave3, Wave4, Wave5, Wave6",Strongly agree = 1; Somewhat agree = 2; Somewhat disagree = 3,5,-1,['other'],other,other
q86,refused to pay taxes or fees to the government,Refused to pay taxes or fees to the government,"Wave2, Wave3, Wave4, Wave5, Wave6",Once = 1; More than once = 2; Never = 3,5,-1,['other'],other,other
q87,got together with others to raise an issue or sign a petition,Got together with others to raise an issue or sign a petition,"Wave2, Wave3, Wave4, Wave5, Wave6",Once = 1; More than once = 2; Never = 3,5,-1,['other'],other,other
q88,attended a demonstration or protest march,Attended a demonstration or protest march,"Wave2, Wave3, Wave4, Wave5, Wave6",Not applicable = 0; Once = 1; More than once = 2,5,-1,['other'],other,other
q89,used force or violence for a political cause,Used force or violence for a political cause,"Wave2, Wave3, Wave4, Wave5, Wave6",Once = 1; More than once = 2; Never = 3,5,-1,['other'],other,other
q92,people often differ in their views on the characteristic that is essential to democracy if you have to choose only one of the things,People often differ in their views on the characteristic that is essential to democracy. If you have to choose only one of the things,"Wave2, Wave3, Wave4, Wave5, Wave6",No answer = 0; Opportunity to change the government through elections = 1; Freedom to criticize those in power = 2,5,-1,['other'],other,other
q95,where would you place our country during the period of,Where would you place our country during the period of [the name of the most recent government under authoritarian rule]?,"Wave2, Wave3, Wave4, Wave5, Wave6",Complete Dictatorship = 1; ... = 2; ... = 3,5,-1,['other'],other,other
q96,where would you place our country under the present government,Where would you place our country under the present government?,"Wave2, Wave3, Wave4, Wave5, Wave6",Complete Dictatorship = 1; ... = 2; ... = 3,5,-1,['other'],other,other
q99,how satisfied or dissatisfied are you with the government,How satisfied or dissatisfied are you with the [name of present] government?,"Wave2, Wave3, Wave4, Wave5, Wave6",Very satisfied = 1; Somewhat satisfied = 2; Somewhat dissatisfied = 3,5,-1,['other'],other,other
q162,impression international monetary fund or imf,Impression: International Monetary Fund or IMF,"Wave2, Wave4, Wave5, Wave6",Very Bad = 1; ... = 2; ... = 3,4,-1,['other'],other,other
q163,impression world bank,Impression: World Bank,"Wave2, Wave4, Wave5, Wave6",Very Bad = 1; ... = 2; ... = 3,4,-1,['other'],other,other
q164,impression united states,Impression: United States,"Wave2, Wave4, Wave5, Wave6",Very Bad = 1; ... = 2; ... = 3,4,-1,['other'],other,other
q165,impression china,Impression: China,"Wave2, Wave4, Wave5, Wave6",Very Bad = 1; ... = 2; ... = 3,4,-1,['other'],other,other
q166,impression japan,Impression: Japan,"Wave2, Wave4, Wave5, Wave6",Very Bad = 1; ... = 2; ... = 3,4,-1,['other'],other,other
q52,when you get together with your family members or friends how often do you discuss political matters,"When you get together with your family members or friends, how often do you discuss political matters?","Wave2, Wave3, Wave4, Wave5",Frequently = 1; Occasionally = 2; Never = 3,4,-1,['other'],other,other
q91,here is a scale 1 means completely undemocratic and 10 means completely democratic where would you place our country under the present government,q91. Here is a scale: 1 means completely undemocratic and 10 means completely democratic. Where would you place our country under the present government?,"Wave3, Wave4, Wave5, Wave6",Missing = -1; Do not understand the question = 97; Can't choose = 98,4,-1,['other'],other,other
q157a,a does china do more good or harm to the region,q157a. Does China do more good or harm to the region?,"Wave3, Wave5, Wave6",Missing = -1; Not applicable = 0; Much more good than harm = 1,3,-1,['other'],other,other
q167,which country should be a model for our own country s future development,167 Which country should be a model for our own country's future development?,"Wave4, Wave5, Wave6",Missing = -1; United States = 1; China = 2,3,-1,['other'],other,other
q168,how much influence does china have on our country,168 How much influence does China have on our country?,"Wave4, Wave5, Wave6",Missing = -1; A great deal of influence = 1; Some influence = 2,3,-1,['other'],other,other
q169,general speaking the influence china has on our country is,"169 General speaking, the influence China has on our country is?","Wave4, Wave5, Wave6",Missing = -1; Very positive = 1; Positive = 2,3,-1,['other'],other,other
q170,how much influence does the united states have on our country,170 How much influence does the United States have on our country?,"Wave4, Wave5, Wave6",Missing = -1; A great deal of influence = 1; Some influence = 2,3,-1,['other'],other,other
q171,general speaking the influence the united states has on our country is,"171 General speaking, the influence the United States has on our country is?","Wave4, Wave5, Wave6",Missing = -1; Very positive = 1; Positive = 2,3,-1,['other'],other,other
q119_1,_1 personally witnessed,119_1 Personally witnessed,"Wave2, Wave3",Not applicable = 0; Yes = 1; No = 2,2,-1,['other'],other,other
q119_2,_2 told about it by family member,119_2 Told about it by family member,"Wave2, Wave3",Not applicable = 0; Yes = 1; No = 2,2,-1,['other'],other,other
q119_3,_3 told about it by friend,119_3 Told about it by friend,"Wave2, Wave3",Not applicable = 0; Yes = 1; No = 2,2,-1,['other'],other,other
q147a,a political leader should not tolerate the views of those who challenge his political ideals,A political leader should not tolerate the views of those who challenge his political ideals,"Wave1, Wave3",Strongly agree = 1; Somewhat agree = 2; Somewhat disagree = 3,2,-1,['other'],other,other
q156_1,_1 our country should do more to learn from other countries q156 q156a,156_1 Our country should do more to learn from other countries(q156+q156a),"Wave5, Wave6",Missing = -1; Not applicable = 0; Strongly disagree = 1,2,-1,['other'],other,other
q156a,a do you strongly agree or just agree with the chosen statement,156a Do you strongly agree or just agree with the chosen statement?,"Wave5, Wave6",Missing = -1; Not applicable = 0; Strongly agree = 1,2,-1,['other'],other,other
q157_1,_1 our country should do more trade with other countries q157 q157a,157_1 Our country should do more trade with other countries(q157+q157a),"Wave5, Wave6",Missing = -1; Not applicable = 0; Strongly disagree = 1,2,-1,['other'],other,other
q172,how close do you feel to asean asean countries only,172 How close do you feel to ASEAN? (ASEAN countries only),"Wave4, Wave5",Missing = -1; Very close = 1; Close = 2,2,-1,['other'],other,other
q173,as long as a government can solve our country s economic problem it does not matter if it is democratic or not democratic,"173 As long as a government can solve our country's economic problem, it does not matter if it is democratic or not democratic","Wave5, Wave6",Missing = -1; Strongly agree = 1; Somewhat agree = 2,2,-1,['other'],other,other
