variable,label_clean,label,wave,value_labels_sample,n_waves,cluster_id,domains,primary_domain,all_domains
q174,which country has the most influence in asia,174 Which country has the most influence in Asia?,"Wave5, Wave6",Missing = -1; China = 1; Japan = 2,2,-1,['other'],other,other
q175,does the united states do more good or harm to asia,175 Does the United States do more good or harm to Asia?,"Wave5, Wave6",Missing = -1; Much more good than harm = 1; Somewhat more good than harm = 2,2,-1,['other'],other,other
q176,the influence of the u s on world affairs today is negative or positive,176 The influence of the U.S. on world affairs today is negative or positive?,"Wave5, Wave6",Missing = -1; 1 Highly negative = 1; 2 = 2,2,-1,['other'],other,other
q177,does china do more good or harm to asia,177  Does China do more good or harm to Asia?,"Wave5, Wave6",Missing = -1; Much more good than harm = 1; Somewhat more good than harm = 2,2,-1,['other'],other,other
q178,the infulece of china on world affairs today is negative or positive,178 The infulece of China on world affairs today is negative or positive?,"Wave5, Wave6",Missing = -1; 1 Highly negative = 1; 2 = 2,2,-1,['other'],other,other
q179,in ten years which country will have the most influence in asia,"179 In ten years, which country will have the most influence in Asia?","Wave5, Wave6",Missing = -1; China = 1; Japan = 2,2,-1,['other'],other,other
q180,which country should be a model for our own country s future development,180 Which country should be a model for our own country's future development?,"Wave5, Wave6",Missing = -1; United States = 1; China = 2,2,-1,['other'],other,other
q181,how much influence does china have on our country,181 How much influence does China have on our country?,"Wave5, Wave6",Missing = -1; A great deal of influence = 1; Some influence = 2,2,-1,['other'],other,other
q182,general speaking the influence china has on our country is,"182 General speaking, the influence China has on our country is?","Wave5, Wave6",Missing = -1; Very positive = 1; Positive = 2,2,-1,['other'],other,other
q183,how much influence does the united states have on our country,183 How much influence does the United States have on our country?,"Wave5, Wave6",Missing = -1; A great deal of influence = 1; Some influence = 2,2,-1,['other'],other,other
q184,general speaking the influence the united states has on our country is,"184 General speaking, the influence the United States has on our country is?","Wave5, Wave6",Missing = -1; Very positive = 1; Positive = 2,2,-1,['other'],other,other
q185,which aspect about the asian power s influence and impact you have in mind when answering the above questions,185 Which aspect about the Asian power's influence and impact you have in mind when answering the above questions?,"Wave5, Wave6",Missing = -1; Politics = 1; Economy = 2,2,-1,['other'],other,other
q186,how close do you feel to asean asean countries only,186 How close do you feel to ASEAN?(ASEAN countries only)?,"Wave5, Wave6",Missing = -1; Very close = 1; Close = 2,2,-1,['other'],other,other
q51,in a group we should sacrifice our individual interest for the sake of the group s collective interest,"q51. In a group, we should sacrifice our individual interest for the sake of the group's collective interest.","Wave3, Wave4",Missing = -1; Missing = 0; Strongly agree = 1,2,-1,['other'],other,other
q51a,from q51 which is most important,From Q51 Which is most important,"Wave2, Wave5",Television = 1; Newspaper = 2; Radio = 3,2,-1,['other'],other,other
q74a,a do you strongly agree or just agree with the chosen statement,q74a. Do you strongly agree or just agree with the chosen statement?,"Wave3, Wave4",Missing = -1; Not applicable = 0; Strongly agree = 1,2,-1,['other'],other,other
q75a,a do you strongly agree or just agree with the chosen statement,q75a. Do you strongly agree or just agree with the chosen statement?,"Wave3, Wave4",Missing = -1; Not applicable = 0; Strongly agree = 1,2,-1,['other'],other,other
q76a,a do you strongly agree or just agree with the chosen statement,q76a. Do you strongly agree or just agree with the chosen statement?,"Wave3, Wave4",Missing = -1; Not applicable = 0; Strongly agree = 1,2,-1,['other'],other,other
q77a,a do you strongly agree or just agree with the chosen statement,q77a. Do you strongly agree or just agree with the chosen statement?,"Wave3, Wave4",Missing = -1; Not applicable = 0; Strongly agree = 1,2,-1,['other'],other,other
q79a,a do you strongly agree or just agree with the chosen statement,q79a. Do you strongly agree or just agree with the chosen statement?,"Wave3, Wave4",Missing = -1; Not applicable = 0; Strongly agree = 1,2,-1,['other'],other,other
q82a,a do you strongly agree or just agree with the chosen statement,82a. Do you strongly agree or just agree with the chosen statement?,"Wave4, Wave5",Missing = -1; Not applicable = 0; Strongly agree = 1,2,-1,['other'],other,other
Q106c,c,"106c:(India only) In your opinion, what are the most important problems facing this country that government should address? (1st response)",Wave5,"Missing = -1; (Women) within this Paradigm but no clear answer = 0; Economy, economic growth, economic development = 1",1,-1,['other'],other,other
Q106d,d,"106d:(India only) In your opinion, what are the most important problems facing this country that government should address? (2nd response)",Wave5,"Missing = -1; (Women) within this Paradigm but no clear answer = 0; Economy, economic growth, economic development = 1",1,-1,['other'],other,other
Q106e,e,"106e:(India only) In your opinion, what are the most important problems facing this country that government should address? (3rd response)",Wave5,"Missing = -1; (Women) within this Paradigm but no clear answer = 0; Economy, economic growth, economic development = 1",1,-1,['other'],other,other
q009,how much trust do you have in political parties,How much trust do you have in political parties?,Wave1,Not sure = 0; None at all = 1; Not very much trust = 2,1,-1,['other'],other,other
q018_2,trust state owned enterprises,TRUST STATE OWNED ENTERPRISES,Wave1,Not sure = 0; None at all = 1; Not very much trust = 2,1,-1,['other'],other,other
q018_3,trust private enterprises,TRUST PRIVATE ENTERPRISES,Wave1,Not sure = 0; None at all = 1; Not very much trust = 2,1,-1,['other'],other,other
q018_4,trust foreign enterprises,TRUST FOREIGN ENTERPRISES,Wave1,Not sure = 0; None at all = 1; Not very much trust = 2,1,-1,['other'],other,other
q018_5,trust our country,TRUST OUR COUNTRY,Wave1,Not sure = 0; None at all = 1; Not very much trust = 2,1,-1,['other'],other,other
q018_7,local mp q18_1,Local MP(q18_1),Wave1,none at all = 1; not very much trust = 2; quite a lot of trust = 3,1,-1,['other'],other,other
q023,how often do you discuss politics,How often do you discuss politics?,Wave1,Never = 1; Rarely = 2; Sometimes = 3,1,-1,['other'],other,other
q024,most people can be trusted,most people can be trusted??,Wave1,One can't be too careful in dealing with them = 1; Most people can be trusted = 2; Both = 3,1,-1,['other'],other,other
q026,i have some friends with influence so i don t have to worry too much if i get into a tight spot,"I have some friends with influence, so I don't have to worry too much if I get into a tight spot",Wave1,Applies very well = 1; Applies pretty well = 2; Doesn't apply much = 3,1,-1,['other'],other,other
q029,did you attend a campaign meeting or rally,Did you attend a campaign meeting or rally?,Wave1,No = 1; Yes = 2; Not applicable = 97,1,-1,['other'],other,other
q044,influential_family member relative,Influential_FAMILY MEMBER/RELATIVE,Wave1,No = 1; Yes = 2; Not applicable = 97,1,-1,['other'],other,other
q045,influential_seniors in a clan or extended family,Influential_SENIORS IN A CLAN OR EXTENDED FAMILY,Wave1,No = 1; Yes = 2; Not applicable = 97,1,-1,['other'],other,other
q048,influential_superior at work school,Influential_SUPERIOR AT WORK/SCHOOL,Wave1,No = 1; Yes = 2; Not applicable = 97,1,-1,['other'],other,other
q049,influential_owners of the firm unit that you work for,Influential_OWNERS OF THE FIRM/UNIT THAT YOU WORK FOR,Wave1,No = 1; Yes = 2; Not applicable = 97,1,-1,['other'],other,other
q051,influential_government official whom you know personally,Influential_GOVERNMENT OFFICIAL WHOM YOU KNOW PERSONALLY,Wave1,No = 1; Yes = 2; Not applicable = 97,1,-1,['other'],other,other
q052,influential_government official whom you don t know,Influential_GOVERNMENT OFFICIAL WHOM YOU DON'T KNOW,Wave1,No = 1; Yes = 2; Not applicable = 97,1,-1,['other'],other,other
q053,influential_candidate party activist whom you know personally,Influential_CANDIDATE/PARTY ACTIVIST WHOM YOU KNOW PERSONALLY,Wave1,No = 1; Yes = 2; Not applicable = 97,1,-1,['other'],other,other
q054,influential_candidate party activist whom you don t know,Influential_CANDIDATE/PARTY ACTIVIST WHOM YOU DON'T KNOW,Wave1,No = 1; Yes = 2; Not applicable = 97,1,-1,['other'],other,other
q055,influential_others,Influential_OTHERS,Wave1,No = 1; Yes = 2; Not applicable = 97,1,-1,['other'],other,other
q061,how much impact do you feel government policies have on your daily life,How much impact do you feel government policies have on your daily life?,Wave1,No impact at all = 1; A little impact = 2; Quite some impact = 3,1,-1,['other'],other,other
q062,party feel closest to,party feel closest to,Wave1,Don't know = 97; No answer = 98; Don't feel close to any political party = 99,1,-1,['other'],other,other
q063,closeness,closeness,Wave1,Extent unknown = 0; Just a little close = 1; Somewhat close = 2,1,-1,['other'],other,other
q064,even if parents demands are unreasonable children still should do what they ask,"Even if parents' demands are unreasonable, children still should do what they ask?",Wave1,Strongly agree = 1; Somewhat agree = 2; Somewhat disagree = 3,1,-1,['other'],other,other
q065,when hiring someone even if a stranger is more qualified the opportunity should still be given to relatives and friend,"When hiring someone, even if a stranger is more qualified, the opportunity should still be given to relatives and friend",Wave1,Strongly agree = 1; Somewhat agree = 2; Somewhat disagree = 3,1,-1,['other'],other,other
q067,wealth and poverty success and failure are all determined by fate,"Wealth and poverty, success and failure are all determined by fate?",Wave1,Strongly agree = 1; Somewhat agree = 2; Somewhat disagree = 3,1,-1,['other'],other,other
q068,a person should not insist on his own opinion if his co workers disagree with him,A person should not insist on his own opinion if his co-workers disagree with him?,Wave1,Strongly agree = 1; Somewhat agree = 2; Somewhat disagree = 3,1,-1,['other'],other,other
q069,for the sake of the family the individual should put his personal interests second,"For the sake of the family, the individual should put his personal interests second?",Wave1,Strongly agree = 1; Somewhat agree = 2; Somewhat disagree = 3,1,-1,['other'],other,other
q070,a man will lose face if he works under a female supervisor,A man will lose face if he works under a female supervisor?,Wave1,Strongly agree = 1; Somewhat agree = 2; Somewhat disagree = 3,1,-1,['other'],other,other
q071,if there is a quarrel we should ask an elder to resolve the dispute,"If there is a quarrel, we should ask an elder to resolve the dispute?",Wave1,Strongly agree = 1; Somewhat agree = 2; Somewhat disagree = 3,1,-1,['other'],other,other
q072,when a mother in law and a daughter in law come into conflict even if the mother in law is in the wrong the husband sh,"When a mother-in-law and a daughter-in-law come into conflict, even if the mother-in-law is in the wrong, the husband sh",Wave1,Strongly agree = 1; Somewhat agree = 2; Somewhat disagree = 3,1,-1,['other'],other,other
q079,demonstrated striken or sat in for something,"Demonstrated, striken, or sat-in for something?",Wave1,Once = 1; More than once = 2; Never done = 9,1,-1,['other'],other,other
q087,did you do this alone or with others _demonstration strike sit in,"Did you do this alone or with others?_demonstration, strike, sit-in",Wave1,No = 1; Yes(with others) = 2; Not applicable = 97,1,-1,['other'],other,other
q095,gift or dinner_demonstration strike sit in,"Gift or dinner_demonstration, strike, sit-in",Wave1,No = 1; Yes(with others) = 2; Not applicable = 97,1,-1,['other'],other,other
q097_1,meaning of democracy first,MEANING OF DEMOCRACY FIRST,Wave1,Evaluation = 1; Freedom = 2; Scepticism = 3,1,-1,['other'],other,other
q097_2,meaning of democracy second,MEANING OF DEMOCRACY SECOND,Wave1,Evaluation = 1; Freedom = 2; Scepticism = 3,1,-1,['other'],other,other
q097_3,meaning of democracy third,MEANING OF DEMOCRACY THIRD,Wave1,Evaluation = 1; Freedom = 2; Scepticism = 3,1,-1,['other'],other,other
q099,where would you place our country on this scale during the period of,Where would you place our country on this scale during the period of [name of the most recent government under authoritarian rule]?,Wave1,Complete dictatorship = 1; Complete democracy = 10; NOT APPLICABLE = 97,1,-1,['other'],other,other
q102a,how likely is it that the government will solve the most important problem you identified,How likely is it that the government will solve the most important problem you identified?,Wave2,Not applicable = 0; Very likely = 1; Likely = 2,1,-1,['other'],other,other
q106a,a what are the most important problems facing this country that government should address 2nd response,106a What are the most important problems facing this country that government should address(2nd response)?,Wave5,"Missing = -1; Management of the economy = 1; Wages, incomes and salaries = 2",1,-1,['other'],other,other
q106b,b what are the most important problems facing this country that government should address 3rd response,106b What are the most important problems facing this country that government should address(3rd response)?,Wave5,"Missing = -1; Management of the economy = 1; Wages, incomes and salaries = 2",1,-1,['other'],other,other
q116e,anyone you know personally witnessed,anyone you know personally witnessed ?,Wave1,Personally = 1; Family member = 2; Friend = 3,1,-1,['other'],other,other
q119a,a did you personally witness it or were you told about it by a family member or friend who personally witnessed personally witnessed,119a Did you personally witness it or were you told about it by a family member or friend who personally witnessed? Personally witnessed,Wave6,Missing = -1; Not applicable = 0; Yes = 1,1,-1,['other'],other,other
q119b,b did you personally witness it or were you told about it by a family member or friend who personally witnessed told about it by a family member who personally witnessed,119b Did you personally witness it or were you told about it by a family member or friend who personally witnessed? Told about it by a family member who personally witnessed,Wave6,Missing = -1; Not applicable = 0; Yes = 1,1,-1,['other'],other,other
q119c,c did you personally witness it or were you told about it by a family member or friend who personally witnessed told about it by a friend who personally witnessed,119c Did you personally witness it or were you told about it by a family member or friend who personally witnessed? Told about it by a friend who personally witnessed,Wave6,Missing = -1; Not applicable = 0; Yes = 1,1,-1,['other'],other,other
q127a_1,a_1 did you personally witness it or were you told about it by a family member or friend who personally witnessed personally witnessed,127a_1 Did you personally witness it or were you told about it by a family member or friend who personally witnessed? personally witnessed,Wave5,Missing = -1; Not applicable = 0; Yes = 1,1,-1,['other'],other,other
q127a_2,a_2 did you personally witness it or were you told about it by a family member or friend who personally witnessed told about it by a family member who personally witnessed,127a_2  Did you personally witness it or were you told about it by a family member or friend who personally witnessed? told about it by a family member who personally witnessed,Wave5,Missing = -1; Not applicable = 0; Yes = 1,1,-1,['other'],other,other
q127a_3,a_3 did you personally witness it or were you told about it by a family member or friend who personally witnessed told about it by a friend who personally witnessed,127a_3  Did you personally witness it or were you told about it by a family member or friend who personally witnessed? told about it by a friend who personally witnessed,Wave5,Missing = -1; Not applicable = 0; Yes = 1,1,-1,['other'],other,other
q129a_q131a,sum of q129a_q131a reject all authoritarian options,sum of Q129a_q131a(reject all authoritarian options),Wave3,0 rejection = 0; 1 acceptance/others = 1,1,-1,['other'],other,other
q130a,one poltical party,one poltical party,Wave3,0 rejection = 0; 1 acceptance/others = 1,1,-1,['other'],other,other
q131a,army,army,Wave3,0 rejection = 0; 1 acceptance/others = 1,1,-1,['other'],other,other
q139a,a did you or a member of your family suffer from serious illness or death,139a Did you or a member of your family suffer from serious illness or death?,Wave6,Missing = -1; Not applicable = 0; Yes = 1,1,-1,['other'],other,other
q139b,b did you or a member of your family suffer from loss of job,139b Did you or a member of your family suffer from loss of job,Wave6,Missing = -1; Not applicable = 0; Yes = 1,1,-1,['other'],other,other
q139c,c did you or a member of your family suffer from loss of household income,139c Did you or a member of your family suffer from loss of household income?,Wave6,Missing = -1; Not applicable = 0; Yes = 1,1,-1,['other'],other,other
q139d,d did you or a member of your family suffer from disruption of my kids education,139d Did you or a member of your family suffer from disruption of my kids' education?,Wave6,Missing = -1; Not applicable = 0; Yes = 1,1,-1,['other'],other,other
q141a,government leader,government leader,Wave3,Missing = -1; Strongly agree = 1; Somewhat agree = 2,1,-1,['other'],other,other
q141a_q147a,average rejection of authoritarian values,average rejection of authoritarian values,Wave3,0 acceptance = 0; 1 rejection authoritarian values = 1,1,-1,['other'],other,other
q142a,certain ideas,certain ideas,Wave3,Missing = -1; Strongly agree = 1; Somewhat agree = 2,1,-1,['other'],other,other
q143e,e to impose a lockdown for a long time,143e To impose a lockdown for a long time,Wave6,Missing = -1; Not applicable = 0; Always = 1,1,-1,['other'],other,other
q145other,other specify responses,145. Other specify responses,Wave6,,1,-1,['other'],other,other
q146a,political leaders,political leaders,Wave3,Missing = -1; Strongly agree = 1; Somewhat agree = 2,1,-1,['other'],other,other
q157b,b does china do more good or harm to the region,q157b. Does China do more good or harm to the region? (Whether the most influence country is China or not.),Wave3,Missing = -1; Not applicable = 0; Much more good than harm = 1,1,-1,['other'],other,other
q159a,a considering all the effort that you and your family members have made in the past do you think the income that your family currently receives is fair or not fair 6 categories,"159a Considering all the effort that you and your family members have made in the past, do you think the income that your family currently receives is fair or not fair-6 categories?",Wave4,Missing = -1; Very fair = 1; Fair = 2,1,-1,['other'],other,other
q172b,b an economic crisis that has caused the loss of many jobs,172b An economic crisis that has caused the loss of many jobs,Wave6,Missing = -1; Not applicable = 0; Very justified = 1,1,-1,['other'],other,other
q172d,d a security crisis due to social unrest or terrorism,172d A security crisis due to social unrest or terrorism,Wave6,Missing = -1; Not applicable = 0; Very justified = 1,1,-1,['other'],other,other
q172e,e the country is at war,172e The country is at war,Wave6,Missing = -1; Not applicable = 0; Very justified = 1,1,-1,['other'],other,other
q173other,other specify responses,173. Other specify responses,Wave6,,1,-1,['other'],other,other
q179other,other specify responses,179. Other specify responses,Wave6,,1,-1,['other'],other,other
q180other,other sepcify responses,180. Other sepcify responses,Wave6,,1,-1,['other'],other,other
q185Other,other specify responses,185. Other specify responses,Wave6,,1,-1,['other'],other,other
q18_other,other specify responses,18 Other specify responses,Wave6,,1,-1,['other'],other,other
q19_other,other specify responses,19 Other specify responses,Wave6,,1,-1,['other'],other,other
q20_other,other specify responses,20 Other specify responses,Wave6,,1,-1,['other'],other,other
q21_other,other specify responses,21 Other specify responses,Wave6,,1,-1,['other'],other,other
q34other,other specify responses,34. Other specify responses,Wave6,,1,-1,['other'],other,other
q51_5,question 51 05 cell phone short message sms,Question 51.05 Cell phone short message (SMS),Wave2,Not applicable = 0; Yes = 1; No = 2,1,-1,['other'],other,other
q51_7,question 51 07 other,Question 51.07 Other,Wave2,Not applicable = 0; Yes = 1; No = 2,1,-1,['other'],other,other
q51_8,magazine,Magazine,Wave2,Not applicable = 0; Yes = 1; No = 2,1,-1,['other'],other,other
q51b_Twitter,b twitter,51b Twitter,Wave6,Missing = -1; Not applicable = 0; Yes = 1,1,-1,['other'],other,other
q51c_Instagram,c instagram,51c Instagram,Wave6,Missing = -1; Not applicable = 0; Yes = 1,1,-1,['other'],other,other
q51d_Youtube,d youtube,51d Youtube,Wave6,Missing = -1; Not applicable = 0; Yes = 1,1,-1,['other'],other,other
q51e_Tiktok,e tiktok,51e Tiktok,Wave6,Missing = -1; Not applicable = 0; Yes = 1,1,-1,['other'],other,other
q51f_Messenger,f messenger,q51f Messenger,Wave6,Missing = -1; Not applicable = 0; Yes = 1,1,-1,['other'],other,other
q51g_Telegram,g telegram,q51g Telegram,Wave6,Missing = -1; Not applicable = 0; Yes = 1,1,-1,['other'],other,other
q51h_Line,h line,q51h Line,Wave6,Missing = -1; Not applicable = 0; Yes = 1,1,-1,['other'],other,other
q51i_Whatsapp,i whatsapp,q51i Whatsapp,Wave6,Missing = -1; Not applicable = 0; Yes = 1,1,-1,['other'],other,other
q51j_Snapchat,j snapchat,q51j Snapchat,Wave6,Missing = -1; Not applicable = 0; Yes = 1,1,-1,['other'],other,other
q51k_Vchat,k vchat,q51k Vchat,Wave6,Missing = -1; Not applicable = 0; Yes = 1,1,-1,['other'],other,other
q51l_Tumblr,l tumblr,q51l Tumblr,Wave6,Missing = -1; Not applicable = 0; Yes = 1,1,-1,['other'],other,other
q53other,other specify responses,53. Other specify responses,Wave6,,1,-1,['other'],other,other
q54other,other specify responses,54. Other specify responses,Wave6,,1,-1,['other'],other,other
q78a,a do you strongly agree or just agree with the chosen statement,q78a. Do you strongly agree or just agree with the chosen statement?,Wave3,Missing = -1; Not applicable = 0; Strongly agree = 1,1,-1,['other'],other,other
q80a,a do you strongly agree or just agree with the chosen statement,80a. Do you strongly agree or just agree with the chosen statement?,Wave4,Missing = -1; Not applicable = 0; Strongly agree = 1,1,-1,['other'],other,other
q81a,a do you strongly agree or just agree with the chosen statement,81a. Do you strongly agree or just agree with the chosen statement?,Wave4,Missing = -1; Not applicable = 0; Strongly agree = 1,1,-1,['other'],other,other
q83a,a do you strongly agree or just agree with the chosen statement,83a Do you strongly agree or just agree with the chosen statement?,Wave5,Missing = -1; Not applicable = 0; Strongly agree = 1,1,-1,['other'],other,other
q84a,a do you strongly agree or just agree with the chosen statement,84a Do you strongly agree or just agree with the chosen statement?,Wave5,Missing = -1; Not applicable = 0; Strongly agree = 1,1,-1,['other'],other,other
q85a,a do you strongly agree or just agree with the chosen statement,85a Do you strongly agree or just agree with the chosen statement?,Wave5,Missing = -1; Not applicable = 0; Strongly agree = 1,1,-1,['other'],other,other
q91_1,to you what does democracy mean what else,"To you, what does ""democracy"" mean?  What else?",Wave2,Don't understand the question = 95; Unclassifiable = 96; No substance in answer = 97,1,-1,['other'],other,other
q91_2,second response,Second Response,Wave2,Don't understand the question = 95; Unclassifiable = 96; No substance in answer = 97,1,-1,['other'],other,other
q91_3,third response,Third Response,Wave2,Don't understand the question = 95; Unclassifiable = 96; No substance in answer = 97,1,-1,['other'],other,other
q97a,a what are the most important problems facing this country that government should address second,97a What are the most important problems facing this country that government should address? Second,Wave6,Missing = -1; Not applicable = 0; Management of the economy = 1,1,-1,['other'],other,other
q97aother,a other specify responses,97a. Other specify responses,Wave6,,1,-1,['other'],other,other
q97b,b what are the most important problems facing this country that government should address third,97b What are the most important problems facing this country that government should address? Third,Wave6,Missing = -1; Not applicable = 0; Management of the economy = 1,1,-1,['other'],other,other
q97bother,b other specify responses,97b. Other specify responses,Wave6,,1,-1,['other'],other,other
q97other,other specify responses,97. Other specify responses,Wave6,,1,-1,['other'],other,other
q99a,a what are the second most important problems facing this country 2nd,99a. What are the second most important problems facing this country? 2nd,Wave4,Missing = -1; Not applicable = 0; Management of the economy = 1,1,-1,['other'],other,other
q99b,b what are the third most important problems facing this country 3rd,99b. What are the third most important problems facing this country? 3rd,Wave4,Missing = -1; Not applicable = 0; Management of the economy = 1,1,-1,['other'],other,other
